{
  "@context": "https://aura-standard.org/context/v1.jsonld",
  "origin_proof_version": "0.1",
  "profiles": ["PDS"],

  "aura_id": "AURA:PDS:EXAMPLE:0001",
  "issued_at": "2026-01-26T12:00:00Z",

  "subject": {
    "aura_id": "AURA:PDI:EXAMPLE:0001",
    "asset_hash": "sha3-256:EXAMPLEASSETDIGEST"
  },

  "declared_scope": {
    "activities": ["training", "fine_tuning", "evaluation"],
    "policy": {
      "default": "prohibited",
      "exceptions": []
    },
    "jurisdictions": ["EU"],
    "effective_from": "2026-01-26T12:00:00Z"
  },

  "rights": {
    "tdm_opt_out": true
  },

  "interpretation": {
    "note": "This is a declarative policy signal. It does not by itself establish legal ownership, enforceability, or authorization."
  },

  "issuer_id": "TPKR:ed25519:EXAMPLEPUBLICKEYFINGERPRINT",

  "canonicalization": "canonical_json_v0",

  "signature": {
    "alg": "ed25519",
    "encoding": "base64url",
    "value": "EXAMPLESIGNATUREBASE64URL"
  }
}
