{
  "@context": "https://aura-standard.org/context/v1.jsonld",
  "origin_proof_version": "0.1",
  "profiles": ["PDI"],

  "aura_id": "AURA:PDI:EXAMPLE:0001",
  "issued_at": "2026-01-26T12:00:00Z",

  "asset": {
    "type": "audio",
    "hash": "sha3-256:EXAMPLEASSETDIGEST"
  },

  "origin": {
    "type": "human",
    "declared_by": "issuer"
  },

  "rights": {
    "tdm_opt_out": true
  },

  "claims": {
    "proves": [
      "integrity_of_the_specific_file_hash",
      "manifest_signature_by_issuer_key",
      "manifest_issue_time_claim",
      "declared_origin_signal"
    ],
    "does_not_prove": [
      "copyright_ownership",
      "originality",
      "authorization_or_license",
      "identity_of_the_creator"
    ]
  },

  "issuer_id": "TPKR:ed25519:EXAMPLEPUBLICKEYFINGERPRINT",

  "canonicalization": "canonical_json_v0",

  "signature": {
    "alg": "ed25519",
    "encoding": "base64url",
    "value": "EXAMPLESIGNATUREBASE64URL"
  }
}
